<?xml version="1.0" encoding="UTF-8"?>
<achievements xmlns="stendhal" xmlns:xsi="http://www.w3.org/2001/XMLSchema-instance"
	xsi:schemaLocation="stendhal ../achievements.xsd ">

  <achievement>
    <identifier>"quest.special.daily_item.0010"</identifier>
    <title>"Ados' Supporter"</title>
    <category>
      <enumeration>QUEST_ADOS_ITEMS</enumeration>
    </category>
    <description>"Finish daily item quest 10 times"</description>
    <score>1</score>
    <active>true</active>
    <condition>
     <questname>"daily_item"</questname>
     <index>2</index>
     <expectedSmallerValue>9</expectedSmallerValue>
    </condition>
  </achievement>
  
  <achievement>
    <identifier>"quest.special.daily_item.0050"</identifier>
    <title>"Ados' Provider"</title>
    <category>
      <enumeration>QUEST_ADOS_ITEMS</enumeration>
    </category>
    <description>"Finish daily item quest 50 times"</description>
    <score>1</score>
    <active>true</active>
    <condition>
     <questname>"daily_item"</questname>
     <index>2</index>
     <expectedSmallerValue>49</expectedSmallerValue>
    </condition>
  </achievement>
  
  <achievement>
    <identifier>"quest.special.daily_item.0100"</identifier>
    <title>"Ados' Supplier"</title>
    <category>
      <enumeration>QUEST_ADOS_ITEMS</enumeration>
    </category>
    <description>"Finish daily item quest 100 times"</description>
    <score>2</score>
    <active>true</active>
    <condition>
     <questname>"daily_item"</questname>
     <index>2</index>
     <expectedSmallerValue>99</expectedSmallerValue>
    </condition>
  </achievement>
  
  <achievement>
    <identifier>"quest.special.daily_item.250"</identifier>
    <title>"Ados' Stockpiler"</title>
    <category>
      <enumeration>QUEST_ADOS_ITEMS</enumeration>
    </category>
    <description>"Finish daily item quest 250 times"</description>
    <score>2</score>
    <active>true</active>
    <condition>
     <questname>"daily_item"</questname>
     <index>2</index>
     <expectedSmallerValue>249</expectedSmallerValue>
    </condition>
  </achievement>
  
  <achievement>
    <identifier>"quest.special.daily_item.500"</identifier>
    <title>"Ados' Hoarder"</title>
    <category>
      <enumeration>QUEST_ADOS_ITEMS</enumeration>
    </category>
    <description>"Finish daily item quest 500 times"</description>
    <score>5</score>
    <active>true</active>
    <condition>
     <questname>"daily_item"</questname>
     <index>2</index>
     <expectedSmallerValue>499</expectedSmallerValue>
    </condition>
  </achievement>


</achievements>
